0,shortbilled-pigeon,LC - Least concern,"Chiriqui Pigeon, Short billed Pigeon",Columba nigrirostris,Pigeons and Doves / Columbiformes,"Pigeons, Doves / Columbidae",Patagioenas,"South America, Middle America",se Mexico to nw Colombia,https://dibird.com/species/shortbilled-pigeon/,-
0,shortbilled-pipit,LC - Least concern,"Short billed Pipit, Short-billed or Puna Pipit",,Perching Birds / Passeriformes,"Wagtails, Pipits / Motacillidae",Anthus,South America,se Brazil to Uruguay and Argentina,https://dibird.com/species/shortbilled-pipit/,-
0,shortclawed-lark,LC - Least concern,"Short clawed Lark, Short-clawed Bush-Lark, Shortclawed Lark","Alauda chuana, Mirafra chuana, Certhilauda breviunguis",Perching Birds / Passeriformes,Larks / Alaudidae,Certhilauda,Africa,"se Botswana and n, ne South Africa",https://dibird.com/species/shortclawed-lark/,-
0,shortcrested-coquette,CR - Critically endangered,"Short-crested Cocquette, Short crested Coquette","Lophornis delattrei brachylopha, Lophornis brachylopha",Swifts and Hummingbirds / Apodiformes,Hummingbirds / Trochilidae,Lophornis,Middle America,sw Mexico,https://dibird.com/species/shortcrested-coquette/,-
0,shortcrested-flycatcher,LC - Least concern,"Fierce Flycatcher, Short crested Flycatcher, Short-crested-Flycatcher, Short-crested Myiarchus",Muscicapa [] ferox,Perching Birds / Passeriformes,"Tyrant Flycatchers, Calyptura / Tyrannidae",Myiarchus,South America,widespread,https://dibird.com/species/shortcrested-flycatcher/,-
0,shortcrested-monarch,NT - Near threatened,"Short-crested Blue-Monarch, Short-crested Blue Monarch, Camiguin Blue-Monarch, Paradise Flycatcher Monarch, Camiguin Monarch, Short crested Monarch",Cyanomyas [sic] helenae,Perching Birds / Passeriformes,Monarchs / Monarchidae,Hypothymis,Oriental Region,Philippines,https://dibird.com/species/shortcrested-monarch/,-
0,shorteared-owl,LC - Least concern,"Marsh owl, Meadow Owl, Pueo, Common Marsh Owl","Asio accipitrinus, Strix flammea",Owls / Strigiformes,Owls / Strigidae,Asio,Worldwide,widespread except AU,https://dibird.com/species/shorteared-owl/,-
0,shortlegged-ground-roller,VU - Vulnerable,"Short legged Ground Roller, Short-tailed Ground Roller, Short-legged Ground-Roller, Short-legged Groundroller",Colaris leptosomus,Kingfishers and relatives / Coraciiformes,Ground Rollers / Brachypteraciidae,Brachypteracias,Africa,Madagascar,https://dibird.com/species/shortlegged-ground-roller/,-
0,shorttailed-albatross,VU - Vulnerable,"Stellar's albatross, Steller's Albatross, Short-tailed Albat",Diomedea albatrus,Albatrosses and Petrels / Procellariiformes,Albatrosses / Diomedeidae,Phoebastria,Pacific ocean,"n, c",https://dibird.com/species/shorttailed-albatross/,-
0,shorttailed-antthrush,LC - Least concern,"Short tailed Antthrush, Short-tailed Ant-thrush, Southern Short-tailed Antthrush","Myiothera campanisona, Chamaeza campanisoma",Perching Birds / Passeriformes,Antthrushes / Formicariidae,Chamaeza,South America,"Venezuela to Bolivia, tepuis and se SA",https://dibird.com/species/shorttailed-antthrush/,-
0,shorttailed-babbler,NT - Near threatened,"Short-tailed Babbler (malaccense), Short-tailed Babbler (nominate)",B [rachypteryx]. malaccensis,Perching Birds / Passeriformes,Ground Babblers / Pellorneidae,Pellorneum,Oriental Region,"Malay Pen., Sumatra and Borneo",https://dibird.com/species/shorttailed-babbler/,-
0,shorttailed-emerald,LC - Least concern,,Ornismya poortmani,Swifts and Hummingbirds / Apodiformes,Hummingbirds / Trochilidae,Chlorostilbon,South America,Colombia and nw Venezuela,https://dibird.com/species/shorttailed-emerald/,-
0,shorttailed-field-tyrant,LC - Least concern,"Short-tailed Field-Tyrant, Short tailed Field Tyrant, Short-tailed Ground-Tyrant",M [uscigralla] brevicauda,Perching Birds / Passeriformes,"Tyrant Flycatchers, Calyptura / Tyrannidae",Muscigralla,South America,Ecuador to n Chile,https://dibird.com/species/shorttailed-field-tyrant/,-
0,shorttailed-finch,LC - Least concern,"Boulder Finch, Short-tailed Diuca-Finch, Short tailed Finch, Short-tailed Finch",,Perching Birds / Passeriformes,Tanagers & Allies / Thraupidae,Idiopsar,South America,s Peru to c Bolivia; s Bolivia and n Argentina,https://dibird.com/species/shorttailed-finch/,-
0,shorttailed-grasswren,NT - Near threatened,Slender-tailed Grasswren,,Perching Birds / Passeriformes,Australasian Wrens / Maluridae,Amytornis,Australasia,s Australia,https://dibird.com/species/shorttailed-grasswren/,-
0,shorttailed-hawk,LC - Least concern,"sooty hawk, Sooty Butterball",,Hawks and relatives / Accipitriformes,"Kites, Hawks, Eagles / Accipitridae",Buteo,"South America, Middle America",e Mexico to n Argentina; also s Florida,https://dibird.com/species/shorttailed-hawk/,-
0,shorttailed-lark,LC - Least concern,Short tailed Lark,"Galerida fremantlii, Pseudalaemon fremantlii, Calendula fremantlii",Perching Birds / Passeriformes,Larks / Alaudidae,Spizocorys,Africa,"e, ne",https://dibird.com/species/shorttailed-lark/,-
0,shorttailed-nighthawk,LC - Least concern,Short-tailed Nighthawk (Short-tailed),Caprimulgus semitorquatus,Nightjars and relatives / Caprimulgiformes,Nightjars / Caprimulgidae,Lurocalis,"South America, Middle America",widespread,https://dibird.com/species/shorttailed-nighthawk/,-
0,shorttailed-paradigalla,LC - Least concern,"Short tailed Paradigalla, Short-tailed Bird-of-paradise",Astrapia brevicauda,Perching Birds / Passeriformes,Birds-of-paradise / Paradisaeidae,Paradigalla,Australasia,"w, c New Guinea",https://dibird.com/species/shorttailed-paradigalla/,-
0,shorttailed-parrot,LC - Least concern,Short tailed Parrot,Psittacus brachyurus,Parrots / Psittaciformes,African & New World Parrots / Psittacidae,Graydidascalus,South America,Amazonia,https://dibird.com/species/shorttailed-parrot/,-
0,shorttailed-parrotbill,LC - Least concern,"David's Parrotbill, Short-tailed crowtit, Short tailed Parrotbill, Père David's Parrotbill","Suthora davidiana, Paradoxornis davidianus, Neosuthora davidianus",Perching Birds / Passeriformes,Parrotbills & Allies / Paradoxornithidae,Neosuthora,Oriental Region,s China and e Myanmar to n Thailand and n Vietnam,https://dibird.com/species/shorttailed-parrotbill/,-
0,shorttailed-pipit,LC - Least concern,"Short tailed Pipit, Shorttailed Pipit",Anthus leggei,Perching Birds / Passeriformes,"Wagtails, Pipits / Motacillidae",Anthus,Africa,sc,https://dibird.com/species/shorttailed-pipit/,-
0,shorttailed-pygmy-tyrant,LC - Least concern,"Short tailed Pygmy Tyrant, Short-tailed Pygmy-Tyrant",T [odirostrum] ecaudatum,Perching Birds / Passeriformes,"Tyrant Flycatchers, Calyptura / Tyrannidae",Myiornis,South America,Amazonia,https://dibird.com/species/shorttailed-pygmy-tyrant/,-
0,shorttailed-scimitar-babbler,NT - Near threatened,"Short-tailed Scimitar-Babbler (Short-tailed), Indochinese Wren-babbler, Short-tailed Scimitar-Babbler, Danjou's Babbler, Scimitar-billed Wren Babbler, Short tailed Scimitar Babbler","Jabouilleia danjoui, Rimator danjoui",Perching Birds / Passeriformes,Ground Babblers / Pellorneidae,Napothera,Oriental Region,Vietnam and Laos,https://dibird.com/species/shorttailed-scimitar-babbler/,-
0,shorttailed-shearwater,LC - Least concern,"Slender-billed Shearwater, Mutton-Bird, Slender-billed Petrel, Tasmanian Muttonbird","Procellaria tenuirostris, Puffinus tenuirostris",Albatrosses and Petrels / Procellariiformes,"Petrels, Shearwaters, Diving Petrels / Procellariidae",Ardenna,Pacific ocean,"n, w",https://dibird.com/species/shorttailed-shearwater/,-
0,shorttailed-starling,LC - Least concern,"Short tailed Starling, Lesser Glossy Starling, Short-tailed Glossy-Starling, Short-tailed Glossy Starling",L [amprotornis] minor,Perching Birds / Passeriformes,"Starlings, Rhabdornis / Sturnidae",Aplonis,Australasia,"Sulawesi, Lesser Sundas and s Philippines",https://dibird.com/species/shorttailed-starling/,-
0,shorttailed-swift,LC - Least concern,Short-tailed Swift (Short-tailed),Acanthylis brachyura,Swifts and Hummingbirds / Apodiformes,Swifts / Apodidae,Chaetura,"South America, Middle America",Panama through Amazonia,https://dibird.com/species/shorttailed-swift/,-
0,shorttailed-woodstar,LC - Least concern,Short tailed Woodstar,Calothorax micrurus,Swifts and Hummingbirds / Apodiformes,Hummingbirds / Trochilidae,Myrmia,South America,w Ecuador and nw Peru,https://dibird.com/species/shorttailed-woodstar/,-
0,shorttoed-coucal,VU - Vulnerable,"Short toed Coucal, Short-taed coucal",,Cuckoos and relatives / Cuculiformes,Cuckoos / Cuculidae,Centropus,Oriental Region,"Malay Pen., Sumatra and Borneo",https://dibird.com/species/shorttoed-coucal/,-
0,shorttoed-rock-thrush,LC - Least concern,"Short-toed Rock-Thrush (Short-toed), Short-toed Rock-Thrush (White-crowned), Shorttoed Rockthrush, Short-toed Rock-Thrush, Short toed Rock Thrush",Petrocincla brevipes,Perching Birds / Passeriformes,"Chats, Old World Flycatchers / Muscicapidae",Monticola,Africa,s,https://dibird.com/species/shorttoed-rock-thrush/,-
0,shorttoed-snake-eagle,LC - Least concern,"Short-toed Snake-Eagle, Snake Eagle, European Snake Eagle, Short-toed Harrier-eagle, European Snake-eagle, Turkestan Snake Buzzard, Short-toed eagle","Falco gallicus, Circaetus ferox",Hawks and relatives / Accipitriformes,"Kites, Hawks, Eagles / Accipitridae",Circaetus,"Eurasia, Oriental Region","sw Europe to c Asia, nw China and India; Lesser Sundas",https://dibird.com/species/shorttoed-snake-eagle/,"e, c, w AF; s, se Asia"
0,shorttoed-treecreeper,LC - Least concern,"Short-toed Creeper, Short-toed Tree-Creeper",,Perching Birds / Passeriformes,Treecreepers / Certhiidae,Certhia,Eurasia,"w, also nw Africa",https://dibird.com/species/shorttoed-treecreeper/,-
0,shortwinged-cisticola,LC - Least concern,"Siffling Cisticola, Shortwing Grass-Warbler, Shortwinged Cisticola, Siftling Cisticola","Drymoeca brachyptera, Cisticola brachyptera",Perching Birds / Passeriformes,Cisticolas & Allies / Cisticolidae,Cisticola,Africa,widespread,https://dibird.com/species/shortwinged-cisticola/,-
0,shovelbilled-kookaburra,LC - Least concern,"Shovel-billed Kingfisher, Emperor Kingfisher, Shovel billed Kookaburra",Dacelo rex,Kingfishers and relatives / Coraciiformes,Kingfishers / Alcedinidae,Clytoceyx,Australasia,New Guinea,https://dibird.com/species/shovelbilled-kookaburra/,-
0,shrikelike-tanager,NT - Near threatened,"White-banded Tanager, White-banded Shrike Tanager, White banded Tanager",Tanagra fasciata,Perching Birds / Passeriformes,Tanagers & Allies / Thraupidae,Neothraupis,South America,ne Bolivia and ne Paraguay to e Brazil,https://dibird.com/species/shrikelike-tanager/,-
0,shy-albatross,NT - Near threatened,"Layard's Albatross, White-capped Albatross (cauta), White-capped Molly, White-capped Albatross, Tasmanian Shy Albatross",Diomedea cauta,Albatrosses and Petrels / Procellariiformes,Albatrosses / Diomedeidae,Thalassarche,Southern ocean,Tasmania and Auckland Is,https://dibird.com/species/shy-albatross/,"widespread in s IO, PO"
0,shy-heathwren,LC - Least concern,"Red-rumped Hylacola, Mallee Heathwren, Shy Heath Wren, Shy Hylacola, Cautious Heathwren, Shy Heath-Wren, Mallee Hylacola, Mallee Heath-Wren","Hylacola cautus, Sericornis cautus, Calamanthus cautus",Perching Birds / Passeriformes,Australasian Warblers / Acanthizidae,Hylacola,Australasia,s Australia,https://dibird.com/species/shy-heathwren/,-
0,siamese-fireback,LC - Least concern,"Diard's fireback pheasant, Diard's Fireback, Siamese Fireback Pheasant","Diardigallus diardi, Euplocomus diardi",Сhickens and relatives / Galliformes,Pheasants & Allies / Phasianidae,Lophura,Oriental Region,se Asia,https://dibird.com/species/siamese-fireback/,-
0,siamese-partridge,NE - Not evaluated,"Chestnut-headed Hill-Partridge, Siamese Hill-Partridge, Chestnut-headed Partridge (Siamese)",,Сhickens and relatives / Galliformes,Pheasants & Allies / Phasianidae,Arborophila,Oriental Region,se Thailand,https://dibird.com/species/siamese-partridge/,-
0,siau-pitta,EN - Endangered,"Siao Pitta, Red-bellied Pitta (palliceps)",Pitta palliceps,Perching Birds / Passeriformes,Pittas / Pittidae,Erythropitta,Australasia,Siau and Tahulandang (ne of Sulawesi),https://dibird.com/species/siau-pitta/,-
0,siau-scops-owl,CR - Critically endangered,"Sulawesi Scops-Owl (Siau), Siau Scops-Owl",Scops siaoensis,Owls / Strigiformes,Owls / Strigidae,Otus,Australasia,Siau I.,https://dibird.com/species/siau-scops-owl/,-
0,siberian-accentor,LC - Least concern,"Mountain Accentor, Siberian Dunnock",Motacilla montanella,Perching Birds / Passeriformes,Accentors / Prunellidae,Prunella,Eurasia,"n, e",https://dibird.com/species/siberian-accentor/,-
0,siberian-blue-robin,LC - Least concern,"Siberian Blue Chat, Siberian Bluechat","Luscinia cyane, Motacilla cyane, Erithacus cyane",Perching Birds / Passeriformes,"Chats, Old World Flycatchers / Muscicapidae",Larvivora,Eurasia,e,https://dibird.com/species/siberian-blue-robin/,se Asia
0,siberian-crane,CR - Critically endangered,"Siberian White Crane, White Crane, Great White Crane","Bugeranus leucogeranus, Grus leucogeranus","Cranes, Rails and relatives / Gruiformes",Cranes / Gruidae,Leucogeranus,Eurasia,"nw, ec Siberia",https://dibird.com/species/siberian-crane/,"Iran, n India and s China"
0,siberian-grouse,NT - Near threatened,"Sharp-winged Grouse, Siberian Spruce-Grouse, Gullible Grouse, Asian spruce grouse, Siberian Spruce Grouse, Sickle-winged Grouse","Tetrao falcipennis, Canachites falcipennis, Dendragapus falcipennis",Сhickens and relatives / Galliformes,Pheasants & Allies / Phasianidae,Falcipennis,Eurasia,e Siberia and Sakhalin I.,https://dibird.com/species/siberian-grouse/,-
0,siberian-jay,LC - Least concern,Grey Jay,Corvus infaustus,Perching Birds / Passeriformes,"Crows, Jays / Corvidae",Perisoreus,Eurasia,n,https://dibird.com/species/siberian-jay/,-
0,siberian-nuthatch,LC - Least concern,"Taiga Nuthatch, Eurasian nuthatch, Eurasian Nuthatch (Siberian)",,Perching Birds / Passeriformes,Nuthatches / Sittidae,Sitta,Eurasia,ne Siberia,https://dibird.com/species/siberian-nuthatch/,-
0,siberian-rubythroat,LC - Least concern,"Greater Kamschatka Nightingale, Greater Kamchatka Nightingale, Common Rubythroat, Rubythroat, Kamchatka Nightingale, Gr. Kamchatka Nightingale","Motacilla calliope, Erithacus calliope, Luscinia calliope",Perching Birds / Passeriformes,"Chats, Old World Flycatchers / Muscicapidae",Calliope,Eurasia,"c, e",https://dibird.com/species/siberian-rubythroat/,OR
0,siberian-stonechat,NE - Not evaluated,"Common bushchat, Eastern Stonechat, Siberian Stonechat (Siberian)","Saxicola torquatus, Muscicapa maura",Perching Birds / Passeriformes,"Chats, Old World Flycatchers / Muscicapidae",Saxicola,Eurasia,"e Caucasus, se Turkey and w Iran, c Siberia, c Asia and the Himalayas to w, c China",https://dibird.com/species/siberian-stonechat/,"ne Africa, s Asia"
0,siberian-thrush,LC - Least concern,"Siberian Ground Thrush, Siberian Ground-Thrush","Turdus sibiricus, Zoothera sibirica",Perching Birds / Passeriformes,Thrushes / Turdidae,Geokichla,Eurasia,e,https://dibird.com/species/siberian-thrush/,se Asia
0,sibilant-sirystes,LC - Least concern,,Muscicapa sibilator,Perching Birds / Passeriformes,"Tyrant Flycatchers, Calyptura / Tyrannidae",Sirystes,South America,"e, sw Brazil to e Paraguay and ne Argentina",https://dibird.com/species/sibilant-sirystes/,-
0,sichuan-bush-warbler,LC - Least concern,"Sichuan Bush-Warbler, Sichuan Grasshopper-warbler",,Perching Birds / Passeriformes,Grassbirds & Allies / Locustellidae,Locustella,Oriental Region,c China,https://dibird.com/species/sichuan-bush-warbler/,-
0,sichuan-jay,VU - Vulnerable,"Black-headed Jay, Szechwan Grey Jay, Szechwan Gray Jay, Chinese Jay, Sooty Jay, Szechwan jay",Boanerges internigrans,Perching Birds / Passeriformes,"Crows, Jays / Corvidae",Perisoreus,Eurasia,wc China,https://dibird.com/species/sichuan-jay/,-
0,sichuan-leaf-warbler,LC - Least concern,"Forrest's Leaf Warbler, Sichuan Leaf-Warbler, Sichuan warbler",Abrornis forresti,Perching Birds / Passeriformes,Leaf Warblers & Allies / Phylloscopidae,Phylloscopus,Oriental Region,sc China,https://dibird.com/species/sichuan-leaf-warbler/,-
0,sichuan-partridge,EN - Endangered,"Szechwan Hill Partridge, Szechwan Partridge, Boulton Hill Partridge, Szechwan Hill-Partridge, Sichuan Hill-Partridge, Boulton's Hill Partridge, Sichuan Hill Partridge, Tree Partridge, Boulton's Hill-Partridge",,Сhickens and relatives / Galliformes,Pheasants & Allies / Phasianidae,Arborophila,Oriental Region,sc China,https://dibird.com/species/sichuan-partridge/,-
0,sichuan-thrush,LC - Least concern,"Plain-backed Thrush (griseiceps), Plain-backed mountain thrush, Sichuan Forest Thrush",Oreocincla griseiceps,Perching Birds / Passeriformes,Thrushes / Turdidae,Zoothera,Oriental Region,sc China and nw Vietnam,https://dibird.com/species/sichuan-thrush/,-
0,sichuan-tit,NE - Not evaluated,,"Parus weigoldicus, Poecile weigoldica, Parus salicarius weigoldi",Perching Birds / Passeriformes,"Tits, Chickadees / Paridae",Poecile,Eurasia,"wc, swc China",https://dibird.com/species/sichuan-tit/,-
0,sichuan-treecreeper,NT - Near threatened,Sichuan Tree-Creeper,Certhia familiaris tianquanensis,Perching Birds / Passeriformes,Treecreepers / Certhiidae,Certhia,Oriental Region,sc China,https://dibird.com/species/sichuan-treecreeper/,-
0,sicklebilled-vanga,LC - Least concern,"Sicklebill Falculea, Sicklebill, Sickle billed Vanga, Falcule",,Perching Birds / Passeriformes,Vangas & Allies / Vangidae,Falculea,Africa,Madagascar,https://dibird.com/species/sicklebilled-vanga/,-
0,sicklewinged-chat,LC - Least concern,"Sicklewing Chat, Red-rumped Sickle-winged Chat, Sicklewinged Chat, Sickle-wing Chat","Cercomela sinuata, Lusc. (inia) sinuata",Perching Birds / Passeriformes,"Chats, Old World Flycatchers / Muscicapidae",Emarginata,Africa,s,https://dibird.com/species/sicklewinged-chat/,-
0,sicklewinged-guan,LC - Least concern,"Sickle winged Guan, Goudot's sickle-winged guan, Goudot's Guan",Ortalida goudotii,Сhickens and relatives / Galliformes,"Chachalacas, Curassows, Guans / Cracidae",Chamaepetes,South America,Colombia to Bolivia,https://dibird.com/species/sicklewinged-guan/,-
0,sicklewinged-nightjar,NT - Near threatened,"Sickled-winged Nightjar, Sickle winged Nightjar",Amblypterus anomalus,Nightjars and relatives / Caprimulgiformes,Nightjars / Caprimulgidae,Eleothreptus,South America,se Brazil; se Paraguay to c Argentina and Uruguay,https://dibird.com/species/sicklewinged-nightjar/,-
0,sicks-swift,LC - Least concern,"Southern Swift, Ashy-tailed Swift",Chaetura andrei meridionalis,Swifts and Hummingbirds / Apodiformes,Swifts / Apodidae,Chaetura,South America,"s Brazil to e Bolivia, Paraguay and n Argentina",https://dibird.com/species/sicks-swift/,"n SA, Panama"
0,sierra-de-lema-flycatcher,LC - Least concern,"McConnell's Flycatcher (Sierra de Lema), Sierra de Lema Flycatcher, MacConnell's Flycatcher (roraimae), Tepui Flycatcher",Pipromorpha oleaginea roraimae,Perching Birds / Passeriformes,"Tyrant Flycatchers, Calyptura / Tyrannidae",Mionectes,South America,"s, se Venezuela, w Guyana and nc Brazil",https://dibird.com/species/sierra-de-lema-flycatcher/,-
0,sierra-leone-prinia,EN - Endangered,White-eyed Prinia,Prinia leontica,Perching Birds / Passeriformes,Cisticolas & Allies / Cisticolidae,Schistolais,Africa,"Guinea, Sierra Leone, Ivory Coast and Liberia",https://dibird.com/species/sierra-leone-prinia/,-
0,sierra-madre-ground-warbler,LC - Least concern,"Sierra Madre Babbler, Sierra Madre Ground-Warbler",,Perching Birds / Passeriformes,Grassbirds & Allies / Locustellidae,Robsonius,Oriental Region,"n Luzon (Sierra Madre, Philippines)",https://dibird.com/species/sierra-madre-ground-warbler/,-
0,sierra-madre-sparrow,EN - Endangered,,Ammodramus baileyi,Perching Birds / Passeriformes,New World Sparrows / Passerellidae,Xenospiza,Middle America,c Mexico,https://dibird.com/species/sierra-madre-sparrow/,-
0,sierra-nevada-brushfinch,NT - Near threatened,"Colombian Brush-Finch, Bangs's Brush-finch, Sierra Nevada Brush Finch, Bangs's Brush Finch, Colombian Brush Finch, Sierra Nevada Brush-Finch",Buarremon basilicus,Perching Birds / Passeriformes,New World Sparrows / Passerellidae,Arremon,South America,"Sierra Nevada de Santa Marta, n Colombia",https://dibird.com/species/sierra-nevada-brushfinch/,-
0,sierran-elaenia,LC - Least concern,"Sierran Elaenia (Andean), Sierran Elaenia [Andean]",Elainea [sic] pallatangae,Perching Birds / Passeriformes,"Tyrant Flycatchers, Calyptura / Tyrannidae",Elaenia,South America,Colombia to Bolivia,https://dibird.com/species/sierran-elaenia/,-
0,sikkim-treecreeper,LC - Least concern,"Brown-throated Treecreeper (Brown-throated), Brown-throated Treecreeper, Brown-throated Tree-Creeper, Sikkim tree creeper","Certhia manipurensis, C.[erthia] discolor",Perching Birds / Passeriformes,Treecreepers / Certhiidae,Certhia,Oriental Region,"Nepal, Tibet, ne India",https://dibird.com/species/sikkim-treecreeper/,-
0,sikkim-wedgebilled-babbler,NT - Near threatened,"Blackish-breasted Babbler, Wedge-billed Wren-Babbler","Sphenocichla humei, Heterorhynchus humei",Perching Birds / Passeriformes,"Babblers, Scimitar Babblers / Timaliidae",Stachyris,Oriental Region,Himalayas of India,https://dibird.com/species/sikkim-wedgebilled-babbler/,-
0,silkytailed-nightjar,LC - Least concern,Silky tailed Nightjar,"Caprimulgus sericocaudatus, Caprimulgus serico-caudatis, Antrostomus serico-caudatis",Nightjars and relatives / Caprimulgiformes,Nightjars / Caprimulgidae,Antrostomus,South America,widespread,https://dibird.com/species/silkytailed-nightjar/,-
0,sillems-mountain-finch,DD - Data deficient,"Sillem's Rosy Finch, Sillem's Mountain-Finch, Tawny-headed Mountain-Finch, Sillem's Rosefinch",Leucosticte sillemi,Perching Birds / Passeriformes,"Finches, Euphonias / Fringillidae",Carpodacus,Oriental Region,n India and sw China,https://dibird.com/species/sillems-mountain-finch/,-
0,silver-gull,LC - Least concern,"Silver Gull (Silver), Red-billed Gull, Australian Silver Gull, Tarapunga","Larus novaehollandiae, Chroicocephala novaehollandiae, Larus novae-hollandiae",Shorebirds / Charadriiformes,"Gulls, Terns, Skimmers / Laridae",Chroicocephalus,Australasia,"Australia, New Zealand and New Caledonia",https://dibird.com/species/silver-gull/,-
0,silver-oriole,EN - Endangered,"Mell's Oriole, Stresemann's Marron Oriole, Stresemann's Maroon Oriole, Mell's maroon oriole, Stresemann's oriole",Oriolus traillii mellianus,Perching Birds / Passeriformes,"Figbirds, Orioles, Turnagra / Oriolidae",Oriolus,Oriental Region,sc China,https://dibird.com/species/silver-oriole/,-
0,silver-pheasant,LC - Least concern,,"Phasianus nycthemerus, Gennaeus nycthemerus",Сhickens and relatives / Galliformes,Pheasants & Allies / Phasianidae,Lophura,Oriental Region,se Asia,https://dibird.com/species/silver-pheasant/,-
0,silver-teal,LC - Least concern,"Northern silver teal, Versicolor teal, Silver Teal (Northern), Silver Teal (versicolor)",Anas versicolor,Ducks and relatives / Anseriformes,"Ducks, Geese, Swans / Anatidae",Spatula,South America,s,https://dibird.com/species/silver-teal/,-
0,silverbacked-butcherbird,LC - Least concern,,,Perching Birds / Passeriformes,"Woodswallows, Butcherbirds & Allies / Artamidae",Cracticus,Australasia,"n, nw Australia",https://dibird.com/species/silverbacked-butcherbird/,-
0,silverbacked-needletail,LC - Least concern,"Gray-throated Spinetail Swift, Cochinchina Spinetail Swift, Gray-throated Needletail, White-vented Spine-tailed Swift, White-vented Needletail, White-vented Spinetailed Swift, Grey-throated Spinetail Swift, Grey-throated Needletail, Needletailed swift, Cochinchina Spine-tailed Swift, Silver backed Needletail",Chaetura cochinchinensis,Swifts and Hummingbirds / Apodiformes,Swifts / Apodidae,Hirundapus,Oriental Region,widespread,https://dibird.com/species/silverbacked-needletail/,-
0,silverbacked-tanager,LC - Least concern,"Silver backed Tanager, Silvery Tanager","Tangara viridicollis, Calliste argentea viridicollis",Perching Birds / Passeriformes,Tanagers & Allies / Thraupidae,Stilpnia,South America,"Ecuador, Peru and Bolivia",https://dibird.com/species/silverbacked-tanager/,-
0,silverbeaked-tanager,LC - Least concern,"Maroon Tanager, Silver-billed Tanager, Common Silverbeak, Silver beaked Tanager",Lanius carbo,Perching Birds / Passeriformes,Tanagers & Allies / Thraupidae,Ramphocelus,South America,"n, w, sc",https://dibird.com/species/silverbeaked-tanager/,-
0,silverbird,LC - Least concern,,"Melaenornis semipartitus, Bradornis semipartitus, Muscicapa semipartita",Perching Birds / Passeriformes,"Chats, Old World Flycatchers / Muscicapidae",Empidornis,Africa,w Sudan to w Kenya and n Tanzania,https://dibird.com/species/silverbird/,-
0,silverbreasted-broadbill,LC - Least concern,"Collared Broadbill, Silver breasted Broadbill, Gould's Broadbill",Eurylaimus lunatus,Perching Birds / Passeriformes,Typical Broadbills / Eurylaimidae,Serilophus,Oriental Region,widespread,https://dibird.com/species/silverbreasted-broadbill/,-
0,silvercapped-fruit-dove,LC - Least concern,"Pink-spotted Fruit Dove, Silver capped Fruit Dove, Silver-capped Fruit-Dove",Ptilopus richardsii,Pigeons and Doves / Columbiformes,"Pigeons, Doves / Columbidae",Ptilinopus,Australasia,Solomon Is.,https://dibird.com/species/silvercapped-fruit-dove/,-
0,silvercrowned-friarbird,LC - Least concern,"Silver-crowned friabird, Silver crowned Friarbird",Tropidorhynchus argenticeps,Perching Birds / Passeriformes,Honeyeaters / Meliphagidae,Philemon,Australasia,n Australia,https://dibird.com/species/silvercrowned-friarbird/,-
0,silvereared-honeyeater,LC - Least concern,"White-eared Honeyeater, Freckled Honeyeater, White-spangled Honeyeater, Eared Honeyeater",Stigmatops albo-auricularis,Perching Birds / Passeriformes,Honeyeaters / Meliphagidae,Lichmera,Australasia,"nc, se New Guinea",https://dibird.com/species/silvereared-honeyeater/,-
