0,rustymargined-flycatcher,LC - Least concern,Rusty margined Flycatcher,"Muscicapa [] cayanensis, Myiozetetes cayenensis",Perching Birds / Passeriformes,"Tyrant Flycatchers, Calyptura / Tyrannidae",Myiozetetes,"South America, Middle America",Panama to se Brazil,https://dibird.com/species/rustymargined-flycatcher/,-
0,rustymargined-guan,LC - Least concern,"Rusty-marginated guan, Superciliated Guan, Rusty margined Guan",,Сhickens and relatives / Galliformes,"Chachalacas, Curassows, Guans / Cracidae",Penelope,South America,"c, e",https://dibird.com/species/rustymargined-guan/,-
0,rustynaped-pitta,LC - Least concern,"Fulvous Pitta, Rusty naped Pitta",Pitta oatesi,Perching Birds / Passeriformes,Pittas / Pittidae,Hydrornis,Oriental Region,se Asia,https://dibird.com/species/rustynaped-pitta/,-
0,rustynecked-piculet,LC - Least concern,"Rusty necked Piculet, Natterer's Piculet",,"Woodpeckers, Toucans and relatives / Piciformes",Woodpeckers / Picidae,Picumnus,South America,ne Bolivia and wc Brazil,https://dibird.com/species/rustynecked-piculet/,-
0,rustytailed-flycatcher,LC - Least concern,,Muscicapa ruficauda,Perching Birds / Passeriformes,"Chats, Old World Flycatchers / Muscicapidae",Ficedula,Eurasia,Uzbekistan and Kyrgyzstan to Nepal and n India,https://dibird.com/species/rustytailed-flycatcher/,sw India
0,rustythroated-wrenbabbler,VU - Vulnerable,"Rusty throated Wren Babbler, Mishmi Wren, Rusty-throated Wren Babbler, Mishmi Wren-Babbler, Mishmi Wren Babbler, Rusty-throated Wren-Babbler",Elachura badeigularis,Perching Birds / Passeriformes,"Babblers, Scimitar Babblers / Timaliidae",Spelaeornis,Oriental Region,ne India (Mishmi Hills),https://dibird.com/species/rustythroated-wrenbabbler/,-
0,rustytinged-antpitta,VU - Vulnerable,"Przevalski's Antpitta, Rusty tinged Antpitta, Przewalski's Antpitta",Grallaricula przewalskii,Perching Birds / Passeriformes,Antpittas / Grallariidae,Grallaria,South America,c Peru,https://dibird.com/species/rustytinged-antpitta/,-
0,rustyvented-canastero,LC - Least concern,"Creamy-breasted Canastero (Rusty-vented), Creamy-breasted Canastero (Creamy-breasted), Creamy-breasted Canastero",Bathmidura dorbignyi,Perching Birds / Passeriformes,Ovenbirds / Furnariidae,Asthenes,South America,Bolivia to nw Argentina,https://dibird.com/species/rustyvented-canastero/,-
0,rustywinged-barbtail,LC - Least concern,Rusty winged Barbtail,"Premnornis guttuligera, Premnormis guttuligera, Thripophaga guttuligera, Margarornis guttuliger, Margarornis guttuligera",Perching Birds / Passeriformes,Ovenbirds / Furnariidae,Premnornis,South America,nw Venezuela to c Peru,https://dibird.com/species/rustywinged-barbtail/,-
0,rustywinged-starling,NT - Near threatened,"Rusty winged Starling, Rufous-winged Starling, New Hebrides Starling","Aplonis zelandicus, Lamprotornis zelandicus",Perching Birds / Passeriformes,"Starlings, Rhabdornis / Sturnidae",Aplonis,Australasia,"Santa Cruz Is., Vanuatu",https://dibird.com/species/rustywinged-starling/,-
0,rwenzori-apalis,LC - Least concern,"Collared Forest-Warbler, Ruwenzori, Ruwenzori Apalis, Kivu Rwenzori Apalis","Apalis ruwenzorii, Apalis ruwenzori, Apalis ruwenzoii",Perching Birds / Passeriformes,Cisticolas & Allies / Cisticolidae,Oreolais,Africa,"e DR Congo, s Uganda, Rwanda and Burundi",https://dibird.com/species/rwenzori-apalis/,-
0,rwenzori-batis,LC - Least concern,"Ruwenzori Puffback-Flycatcher, Ruwenzori Puffback, Ruwenzori Puff-back Flycatcher, Ruwenzori Batis, Ruwenzori Puffback Flycatcher, Ruwenzori Puff Back Flycatcher",,Perching Birds / Passeriformes,"Wattle-eyes, Batises / Platysteiridae",Batis,Africa,"ec DR Congo, sw Uganda, w Rwanda and w Burundi",https://dibird.com/species/rwenzori-batis/,-
0,rwenzori-doublecollared-sunbird,LC - Least concern,"Stuhlmann's Sunbird, Stuhlmann's Double-collared Sunbird, Ruwenzori Double-collared Sunbird, Stuhlmann's Double collared Sunbird",Nectarinia stuhlmanni,Perching Birds / Passeriformes,Sunbirds / Nectariniidae,Cinnyris,Africa,sc,https://dibird.com/species/rwenzori-doublecollared-sunbird/,-
0,rwenzori-hill-babbler,LC - Least concern,"Ruwenzori Fulvetta, African Hill Babbler (Ruwenzori), African Hill Babbler (Rwenzori), Ruwenzori Hill Babbler, Rwenzori Hill-Babbler, Ruwenzori Babbler, Ruwenzori Hill-Babbler","Illadopsis atriceps, Turdinus atriceps, Pseudoalcippe atriceps, Alcippe atriceps",Perching Birds / Passeriformes,Sylviid Babblers / Sylviidae,Sylvia,Africa,"se Nigeria, sw Cameroon, ec DR Congo, w Uganda, Rwanda and Burundi",https://dibird.com/species/rwenzori-hill-babbler/,-
0,rwenzori-turaco,LC - Least concern,"Ruwenzori Lourie, Ruwenzori Touraco, Ruwenzori Turaco, Johnston's Turaco","Musophaga johnstoni, Tauraco johnstoni, Ruwenzorornis johnstoni",Turacos / Musophagiformes,Turacos / Musophagidae,Gallirex,Africa,c,https://dibird.com/species/rwenzori-turaco/,-
0,ryukyu-minivet,LC - Least concern,"Ashy minivet, Ryu Kyu Minivet, Japanese Minivet",,Perching Birds / Passeriformes,Cuckooshrikes / Campephagidae,Pericrocotus,Eurasia,s Japan,https://dibird.com/species/ryukyu-minivet/,-
0,ryukyu-robin,NT - Near threatened,"Riukiu Robin, Riuliu Robin, Ryu Kyu Robin, Korean Robin, Temminck's Robin","Erithacus komadori, Sylvia komadori, Luscinia komadori",Perching Birds / Passeriformes,"Chats, Old World Flycatchers / Muscicapidae",Larvivora,Eurasia,n Ryukyu Is.,https://dibird.com/species/ryukyu-robin/,to s Ryukyu Is.
0,ryukyu-wood-pigeon,EX - Extinct,"Ryukyu Woodpigeon, Silver-banded Pigeon, Ryuku Wood Pigeon, Jouyi's wood pigeon, Ryukyu Pigeon, Jouy's Pigeon, Ryu Kyu Pigeon, Silver-banded Black Pigeon, Ryu Kyu Wood Pigeon, Silver-banded Wood Pigeon, Jouy's Wood Pigeon",Janthoenas jouyi,Pigeons and Doves / Columbiformes,"Pigeons, Doves / Columbidae",Columba,Eurasia,"Okinawa and Daito I., Ryukyu Is.",https://dibird.com/species/ryukyu-wood-pigeon/,-
0,sabines-gull,LC - Least concern,Fork-tailed Gull,"Larus sabini, Xema sabinii",Shorebirds / Charadriiformes,"Gulls, Terns, Skimmers / Laridae",Xema,"North America, Eurasia",n coasts,https://dibird.com/species/sabines-gull/,"nw SA, sw AF, coasts"
0,sabines-puffback,LC - Least concern,"Sabine's Puffback Shrike, Sabine's Puff Back, Large-billed Puffback, Large billed Puffback, Sabin's Puffback",Thamnophilus sabini,Perching Birds / Passeriformes,Bushshrikes / Malaconotidae,Dryoscopus,Africa,"w, c",https://dibird.com/species/sabines-puffback/,-
0,sabines-spinetail,LC - Least concern,"Sabine's Needletail, Sabine's Spinetail Swift, Gabon Sabine's Spinetail, Sabine's Spine-tailed Swift, Sabine's Spinetailed Swift","Raphidura sabini, Chaetura sabini",Swifts and Hummingbirds / Apodiformes,Swifts / Apodidae,Rhaphidura,Africa,Sierra Leone to w Uganda and w Kenya,https://dibird.com/species/sabines-spinetail/,-
0,sabota-lark,LC - Least concern,"Small-billed Sabota Lark, Large-billed Sabota Lark",Mirafra sabota,Perching Birds / Passeriformes,Larks / Alaudidae,Calendulauda,Africa,s,https://dibird.com/species/sabota-lark/,-
0,sacred-kingfisher,LC - Least concern,,"Halcyon sancta, Halcyon sanctus",Kingfishers and relatives / Coraciiformes,Kingfishers / Alcedinidae,Todiramphus,"Australasia, Oriental Region","Australia, New Zealand and islands in the region",https://dibird.com/species/sacred-kingfisher/,Sumatra to New Guinea
0,sad-flycatcher,LC - Least concern,"Jamaican Flycatcher, Dusky-capped Flycatcher",Tyrannula barbirostris,Perching Birds / Passeriformes,"Tyrant Flycatchers, Calyptura / Tyrannidae",Myiarchus,North America,Jamaica,https://dibird.com/species/sad-flycatcher/,-
0,saddlebilled-stork,LC - Least concern,"African Jabiru, Saddle-bill Stork, Saddlebilled Stork, Saddlebill Stork, Saddle billed Stork, Saddlebill","Ephippiorrhynchus senegalensis, Mycteria senegalensis","Herons, Storks and relatives / Ciconiiformes",Storks / Ciconiidae,Ephippiorhynchus,Africa,widespread s of the Sahara,https://dibird.com/species/saddlebilled-stork/,-
0,saffron-finch,LC - Least concern,"Saffron Yellow-Finch, Sparrow Finch, Yellow Finch","Fringilla flaveola, Sicalis striata",Perching Birds / Passeriformes,Tanagers & Allies / Thraupidae,Sicalis,South America,"n, wc, se, sc",https://dibird.com/species/saffron-finch/,-
0,saffron-siskin,VU - Vulnerable,,"Carduelis siemiradzkii, Carduelis seimiradzkii, Sporagra siemiradzkii, Chrysomitris siemiradzkii",Perching Birds / Passeriformes,"Finches, Euphonias / Fringillidae",Spinus,South America,sw Ecuador and nw Peru,https://dibird.com/species/saffron-siskin/,-
0,saffron-toucanet,NT - Near threatened,"Banana Toucan, Baillon's Toucan","Andigena bailloni, Ramphastos bailloni, Baillonius bailloni","Woodpeckers, Toucans and relatives / Piciformes",Toucans / Ramphastidae,Pteroglossus,South America,"se Brazil, e Paraguay and ne Argentina",https://dibird.com/species/saffron-toucanet/,-
0,saffronbilled-sparrow,LC - Least concern,Saffron billed Sparrow,,Perching Birds / Passeriformes,New World Sparrows / Passerellidae,Arremon,South America,"se, sc",https://dibird.com/species/saffronbilled-sparrow/,-
0,saffroncowled-blackbird,VU - Vulnerable,"Saffron-crowned Blackbird, Saffron cowled Blackbird, Saffron-crowned Marsh-Blackbird","Oriolus flavus, Agelaius flavus",Perching Birds / Passeriformes,"Oropendolas, Orioles, Blackbirds / Icteridae",Xanthopsar,South America,"e Paraguay, s Brazil, ne Argentina and Uruguay",https://dibird.com/species/saffroncowled-blackbird/,-
0,saffroncrested-tyrantmanakin,LC - Least concern,"Saffron-crested Manakin, Saffron-crested Tyrant Manakin, Saffron-crested tyrant, Saffron-crested Neopelma, Saffron crested Tyrant Manakin","Heteropelma chrysocephalum, Neopelma chrysocephalus",Perching Birds / Passeriformes,Manakins / Pipridae,Neopelma,South America,n Amazonia,https://dibird.com/species/saffroncrested-tyrantmanakin/,-
0,saffroncrowned-tanager,LC - Least concern,Saffron crowned Tanager,Callospiza xanthocephala,Perching Birds / Passeriformes,Tanagers & Allies / Thraupidae,Tangara,South America,Venezuela to Bolivia,https://dibird.com/species/saffroncrowned-tanager/,-
0,saffronheaded-parrot,NT - Near threatened,"Saffron headed Parrot, Bonaparte's Parrot","Pionopsitta pyrilia, Gypopsitta pyrilia, Psittacula pyrilia",Parrots / Psittaciformes,African & New World Parrots / Psittacidae,Pyrilia,"South America, Middle America",e Panama to nw Venezuela,https://dibird.com/species/saffronheaded-parrot/,-
0,sage-thrasher,LC - Least concern,Mountain Mockingbird,"Orpheus montanus, Oroscoptes montanus, Oreoscopotes montanus",Perching Birds / Passeriformes,"Mockingbirds, Thrashers / Mimidae",Oreoscoptes,North America,"w, sw USA",https://dibird.com/species/sage-thrasher/,c Mexico
0,sagebrush-sparrow,LC - Least concern,"Northern Sage Sparrow, Sage Sparrow (Northern), Sage Sparrow","Amphispiza nevadensis, Poospiza bellii nevadensis",Perching Birds / Passeriformes,New World Sparrows / Passerellidae,Artemisiospiza,North America,wc USA,https://dibird.com/species/sagebrush-sparrow/,sw USA and n Mexico
0,sahel-bush-sparrow,LC - Least concern,"Lesser Rock Sparrow, Sahel Bush-sparrow, Russet-browed Bush-sparrow, Bush Petronia, Lesser Petronia, Bush Sparrow","Gymnornis dentata, Xanthodira dentata, Petronia dentata",Perching Birds / Passeriformes,"Old World Sparrows, Snowfinches / Passeridae",Gymnoris,Africa,"Mauritania to Guinea and e to Eritrea, Ethiopia and South Sudan; also sw Arabian Pen.",https://dibird.com/species/sahel-bush-sparrow/,-
0,sahel-paradise-whydah,LC - Least concern,"Northern Paradise Whydah, Northern Paradise Widow, Sahel Paradise Widow, Sahel Paradise-Whydah, Broad-tailed Paradise-Whydah, Northern Paradise-Whydah, Broad-tailed Paradise Whydah",Vidua paradisea orientalis,Perching Birds / Passeriformes,"Indigobirds, Whydahs / Viduidae",Vidua,Africa,"w, c, ne",https://dibird.com/species/sahel-paradise-whydah/,-
0,saipan-reed-warbler,CR - Critically endangered,"Hiwai's Warbler, Saipan Reed-Warbler",Conopoderas luscinia hivae,Perching Birds / Passeriformes,Reed Warblers & Allies / Acrocephalidae,Acrocephalus,Pacific ocean,"Saipan, Almagan (Northern Mariana Is.)",https://dibird.com/species/saipan-reed-warbler/,-
0,sakalava-rail,EN - Endangered,"Olivier's Rail, Olivier's Crake, Oliver's rail","Porzana olivieri, Amaurornis olivieri","Cranes, Rails and relatives / Gruiformes","Rails, Crakes & Coots / Rallidae",Zapornia,Africa,Madagascar,https://dibird.com/species/sakalava-rail/,-
0,sakalava-weaver,LC - Least concern,Sakalava Fody,Foudia sakalava,Perching Birds / Passeriformes,"Weavers, Widowbirds / Ploceidae",Ploceus,Africa,Madagascar,https://dibird.com/species/sakalava-weaver/,-
0,saker-falcon,EN - Endangered,"Cherrug Falcon, Saker, Saker or Altai Falcon, Snake Falcon",,Falcons / Falconiformes,"Caracaras, Falcons / Falconidae",Falco,Eurasia,"c Europe to c Asia, s Siberia, n China, Himalayas and Tibet",https://dibird.com/species/saker-falcon/,ne AF and n OR
0,sakhalin-grasshopper-warbler,LC - Least concern,"Stepanyan's Grasshopper Warbler, Sakhalin Grasshopper-Warbler, Stepanyan's Warbler, Sakhalin Warbler, Sakhalin Gray's Grasshopper-Warbler, Stepanyan's Grasshopper-Warbler",Locustella amnicola,Perching Birds / Passeriformes,Grassbirds & Allies / Locustellidae,Helopsaltes,Eurasia,"Sakhalin, s Kuril Is. and Hokkaido",https://dibird.com/species/sakhalin-grasshopper-warbler/,Philippines
0,sakhalin-leaf-warbler,LC - Least concern,"Japanese Pale-legged Willow Warbler, Sakhalin Leaf-Warbler","Phylloscopus tenellipes borealoides, Acanthopneuste borealoides, Seicercus borealoides",Perching Birds / Passeriformes,Leaf Warblers & Allies / Phylloscopidae,Phylloscopus,Eurasia,Japan,https://dibird.com/species/sakhalin-leaf-warbler/,se Asia
0,salim-alis-swift,NE - Not evaluated,,"Apus pacificus salimalii, Apus salimali",Swifts and Hummingbirds / Apodiformes,Swifts / Apodidae,Apus,Eurasia,e Tibetan Plateau and adjacent w Sichuan,https://dibird.com/species/salim-alis-swift/,-
0,salinas-monjita,NE - Not evaluated,Salinas Tyrant,"Xolmis rubetra salinarum, Xolmis salinarum",Perching Birds / Passeriformes,"Tyrant Flycatchers, Calyptura / Tyrannidae",Neoxolmis,South America,nc Argentina,https://dibird.com/species/salinas-monjita/,-
0,salmoncrested-cockatoo,VU - Vulnerable,"Salmon-crested cackatoo, Rose cackatoo, Moluccan Cockatoo, Salmon crested Cockatoo","Kakatoe moluccensis, Psittacus moluccensis",Parrots / Psittaciformes,Cockatoos / Cacatuidae,Cacatua,Australasia,s Moluccas,https://dibird.com/species/salmoncrested-cockatoo/,-
0,saltmarsh-sparrow,EN - Endangered,"Saltmarsh Sharp-tailed Sparrow, Sharp-tailed Sparrow, Saltmarsh Sparrow (nominate), Saltmarsh Sparrow (caudacuta)",Oriolus caudacutus,Perching Birds / Passeriformes,New World Sparrows / Passerellidae,Ammospiza,North America,"e, ne USA",https://dibird.com/species/saltmarsh-sparrow/,se USA
0,salvadoris-antwren,VU - Vulnerable,,,Perching Birds / Passeriformes,Antbirds / Thamnophilidae,Myrmotherula,South America,se Brazil,https://dibird.com/species/salvadoris-antwren/,-
0,salvadoris-eremomela,NE - Not evaluated,,,Perching Birds / Passeriformes,Cisticolas & Allies / Cisticolidae,Eremomela,Africa,"se Gabon e to s DR Congo , Angola and w Zambia",https://dibird.com/species/salvadoris-eremomela/,-
0,salvadoris-fig-parrot,LC - Least concern,"Whiskered Fig-Parrot, Salvadori's Fig-Parrot, Yellow-cheeked Fig Parrot",Cyclopsittacus salvadorii,Parrots / Psittaciformes,Old World Parrots / Psittaculidae,Psittaculirostris,Australasia,nw New Guinea,https://dibird.com/species/salvadoris-fig-parrot/,-
0,salvadoris-nightjar,NT - Near threatened,,,Nightjars and relatives / Caprimulgiformes,Nightjars / Caprimulgidae,Caprimulgus,Oriental Region,"Sumatra, Java",https://dibird.com/species/salvadoris-nightjar/,-
0,salvadoris-pheasant,NT - Near threatened,Salvadori's Pheasant (Salvadori's),Acomus inornatus,Сhickens and relatives / Galliformes,Pheasants & Allies / Phasianidae,Lophura,Oriental Region,Sumatra,https://dibird.com/species/salvadoris-pheasant/,-
0,salvadoris-seedeater,VU - Vulnerable,"Salvadori's Serin, Salvadori's Seed-eater, Salvadori's Canary","Serinus xantholaemus, Serinus xantholaema, Ochrospiza xantholaema",Perching Birds / Passeriformes,"Finches, Euphonias / Fringillidae",Crithagra,Africa,Ethiopia,https://dibird.com/species/salvadoris-seedeater/,-
0,salvadoris-teal,VU - Vulnerable,Salvadori's Duck,Anas waigiuensis,Ducks and relatives / Anseriformes,"Ducks, Geese, Swans / Anatidae",Salvadorina,Australasia,New Guinea,https://dibird.com/species/salvadoris-teal/,-
0,salvins-albatross,VU - Vulnerable,"Layard's Mollymawk, Grey-backed Albatross, Gray-backed Mollymawk, Grey-backed Mollymawk, Bounty Mollymawk, Gray-backed Albatross, Bounty Albatross","Diomedea salvini, Thalassogeron salvini",Albatrosses and Petrels / Procellariiformes,Albatrosses / Diomedeidae,Thalassarche,"Pacific ocean, Indian ocean",Bounty Is. and w Snares Is.,https://dibird.com/species/salvins-albatross/,widespread in SO
0,salvins-curassow,LC - Least concern,Salvin's razor-billed curassow,"Mitua salvini, Crax salvini",Сhickens and relatives / Galliformes,"Chachalacas, Curassows, Guans / Cracidae",Mitu,South America,w Amazonia,https://dibird.com/species/salvins-curassow/,-
0,salvins-prion,LC - Least concern,"Mediumbilled Prion, Medium-billed Prion, Salvin's Prion (Salvin's)",Prion vittatus salvini,Albatrosses and Petrels / Procellariiformes,"Petrels, Shearwaters, Diving Petrels / Procellariidae",Pachyptila,Indian ocean,s,https://dibird.com/species/salvins-prion/,-
0,samar-hornbill,NE - Not evaluated,Samar Tarictic Hornbill,,Hornbills and relatives / Bucerotiformes,Hornbills / Bucerotidae,Penelopides,Oriental Region,c Philippines,https://dibird.com/species/samar-hornbill/,-
0,samoan-fantail,LC - Least concern,Somoan Fantail,,Perching Birds / Passeriformes,Fantails / Rhipiduridae,Rhipidura,Pacific ocean,w Samoa,https://dibird.com/species/samoan-fantail/,-
0,samoan-flycatcher,NT - Near threatened,"White vented Flycatcher, Samoan Myiagra, White-vented Flycatcher, Samoan Broadbill, Samoan Myiagra Flycatcher",Platyrhynchus albiventris,Perching Birds / Passeriformes,Monarchs / Monarchidae,Myiagra,Pacific ocean,w Samoa,https://dibird.com/species/samoan-flycatcher/,-
0,samoan-starling,LC - Least concern,,"Aplonis atrifuscus, Aplonis artifusca, Aplonas atrifusca, Lamprotornis atrifusca",Perching Birds / Passeriformes,"Starlings, Rhabdornis / Sturnidae",Aplonis,Pacific ocean,Samoa,https://dibird.com/species/samoan-starling/,-
0,samoan-triller,NT - Near threatened,,,Perching Birds / Passeriformes,Cuckooshrikes / Campephagidae,Lalage,Pacific ocean,w Samoa,https://dibird.com/species/samoan-triller/,-
0,samoan-whistler,LC - Least concern,"Yellow fronted Whistler, Yellow-fronted Whistler",Eopsaltria flavifrons,Perching Birds / Passeriformes,Whistlers & Allies / Pachycephalidae,Pachycephala,Pacific ocean,w Samoa,https://dibird.com/species/samoan-whistler/,-
0,samoan-whiteeye,VU - Vulnerable,"Savaii White-eye, Samoan White eye",,Perching Birds / Passeriformes,White-eyes / Zosteropidae,Zosterops,Pacific ocean,w Samoa,https://dibird.com/species/samoan-whiteeye/,-
0,samoan-woodhen,CR - Critically endangered,"Samoan Moorhen, Samoan Wood Rail, Tahiti rail, Samoan Gallinule",Pareudiastes pacificus,"Cranes, Rails and relatives / Gruiformes","Rails, Crakes & Coots / Rallidae",Gallinula,Pacific ocean,w Samoa,https://dibird.com/species/samoan-woodhen/,-
0,san-andres-vireo,VU - Vulnerable,"St Andrew Vireo, San Andrés Vireo, St. Andrew Vireo, St.Andrew vireo",,Perching Birds / Passeriformes,"Vireos, Greenlets, Shrike-babblers / Vireonidae",Vireo,Middle America,Isla Andrés,https://dibird.com/species/san-andres-vireo/,-
0,san-blas-jay,LC - Least concern,Black-and-blue Jay,"Cyanocorax sanblasiana, Pica san-blasiana, Cissilopha san-blasiana, Cissilopha sanblasiana",Perching Birds / Passeriformes,"Crows, Jays / Corvidae",Cyanocorax,Middle America,w Mexico,https://dibird.com/species/san-blas-jay/,-
0,sand-lark,LC - Least concern,"Indian Sand Lark, Asian Short-toed Lark, Sandlark, Indian Sandlark, Ganges Snad Lark, Indian Short-toed Lark","Calandrella raytal, Alauda raytal",Perching Birds / Passeriformes,Larks / Alaudidae,Alaudala,Oriental Region,Iran to Myanmar,https://dibird.com/species/sand-lark/,-
0,sand-martin,LC - Least concern,"Collared Sand Martin/Bank Swallow, European Sand Martin, Sand Swallow, Collared Sand Martin, Collared Sand-Martin, Common Sand-Martin, Gorgeted Sand-Martin, Common Sand Martin, Bank Swallow",Hirundo riparia,Perching Birds / Passeriformes,"Swallows, Martins / Hirundinidae",Riparia,Worldwide,widespread,https://dibird.com/species/sand-martin/,-
0,sand-partridge,LC - Least concern,"Seesee, Sand partrige, San Partridge","Perdix heyi, Ammoperdix hayi, Ammoperdrix heyi",Сhickens and relatives / Galliformes,Pheasants & Allies / Phasianidae,Ammoperdix,"Africa, Eurasia","Arabian Pen., Egypt and n Sudan",https://dibird.com/species/sand-partridge/,-
0,sanderling,LC - Least concern,Ruddy Plover,"Tringa alba, Crocethia alba, Ereunetes albus, Calidris leucophaea, Calidris arenaria",Shorebirds / Charadriiformes,"Sandpipers, Snipes / Scolopacidae",Calidris,"North America, Eurasia",n,https://dibird.com/species/sanderling/,Worldwide
0,sandhill-crane,LC - Least concern,"Florida Crane, Little brown Crane","Grus canadensis, Ardea canadensis","Cranes, Rails and relatives / Gruiformes",Cranes / Gruidae,Antigone,North America,widespread,https://dibird.com/species/sandhill-crane/,to nc Mexico
0,sandstone-shrikethrush,LC - Least concern,"Sandstone Shrike Thrush, Sandstone Thrush, Brown-breasted Shrike Thrush, Sandstone Shrike-Thrush, Brown-breasted Shrike-Thrush",,Perching Birds / Passeriformes,Whistlers & Allies / Pachycephalidae,Colluricincla,Australasia,n Australia,https://dibird.com/species/sandstone-shrikethrush/,-
0,sandwich-tern,LC - Least concern,"Eurasian Sandwich Tern, Sandwich Tern (Eurasian)",Sterna sandvicensis,Shorebirds / Charadriiformes,"Gulls, Terns, Skimmers / Laridae",Thalasseus,"Africa, Eurasia","n Europe to Mediterranean, Black and Caspian Seas",https://dibird.com/species/sandwich-tern/,"s Europe to n Africa, Persian Gulf and India"
0,sandy-gallito,LC - Least concern,Barrancolino,Rhinocrypta fusca,Perching Birds / Passeriformes,Tapaculos / Rhinocryptidae,Teledromas,South America,c Argentina,https://dibird.com/species/sandy-gallito/,-
0,sandy-scops-owl,LC - Least concern,"Cinnamon Scops-Owl, Sandy Scops-Owl, Cinnamon Scops Owl","Scops icterorhynchus, Otus holerythrus, Otus icterorhynchos",Owls / Strigiformes,Owls / Strigidae,Otus,Africa,"w, c",https://dibird.com/species/sandy-scops-owl/,-
0,sanfords-sea-eagle,VU - Vulnerable,"Sandford's Sea Eagle, Sandford's Eagle, Solomon Islands Sea-Eagle, Solomon Fish-eagle, Solomon Islands Sea Eagle, Solomons Sea-eagle, Sanford's Eagle, Sanford's fish eagle, Sanford's Fish-Eagle, Sanford's Sea-eagle, Forest Fish Eagle, Sandford's Fish-eagle, Solomon Sea-eagle",,Hawks and relatives / Accipitriformes,"Kites, Hawks, Eagles / Accipitridae",Haliaeetus,Australasia,Solomon Is.,https://dibird.com/species/sanfords-sea-eagle/,-
0,sanfords-whiteeye,NT - Near threatened,Sanford's White eye,"Sanfordia lacertosa, Woodfordia lacertosa",Perching Birds / Passeriformes,White-eyes / Zosteropidae,Zosterops,Australasia,Santa Cruz Is.,https://dibird.com/species/sanfords-whiteeye/,-
0,sangihe-hanging-parrot,NT - Near threatened,"Sangihe Hanging-Parrot, Sangir Hanging Parrot",Loriculus catamenae,Parrots / Psittaciformes,Old World Parrots / Psittaculidae,Loriculus,Australasia,Sangihe I.,https://dibird.com/species/sangihe-hanging-parrot/,-
0,sangihe-pitta,EN - Endangered,Red-bellied Pitta (caeruleitorques),Pitta caeruleitorques,Perching Birds / Passeriformes,Pittas / Pittidae,Erythropitta,Australasia,Sangihe I. (ne of Sulawesi,https://dibird.com/species/sangihe-pitta/,-
0,sangihe-scops-owl,LC - Least concern,"Sangir Scops Owl, Sangihe scops owl, Sangihe Scops-Owl",,Owls / Strigiformes,Owls / Strigidae,Otus,Australasia,Sangihe I.,https://dibird.com/species/sangihe-scops-owl/,-
0,sangihe-shrikethrush,CR - Critically endangered,"Sangir Whistler, Sangihe Shrike-thrush, Large Tyrannine Woodcreeper, Sahengbalira Shrike-thrush, Sangihe Whistler","Dendrocincla macrorhyncha, Pinarolestes sanghirensis, Colluricincla sanghirensis",Perching Birds / Passeriformes,Whistlers & Allies / Pachycephalidae,Coracornis,Australasia,Sangihe Island,https://dibird.com/species/sangihe-shrikethrush/,-
0,sangihe-whiteeye,CR - Critically endangered,"Sangihi White-eye, Sangir White-eye",,Perching Birds / Passeriformes,White-eyes / Zosteropidae,Zosterops,Australasia,Sangihe Is.,https://dibird.com/species/sangihe-whiteeye/,-
0,sangkar-whiteeye,NE - Not evaluated,,Zosterops melanura,Perching Birds / Passeriformes,White-eyes / Zosteropidae,Zosterops,Oriental Region,Java and Bali,https://dibird.com/species/sangkar-whiteeye/,-
0,santa-cruz-ground-dove,EN - Endangered,"Santa Cruz Ground-Dove, Santa Cruz Ground Pigeon","Alopecoenas sanctaecrucis, Gallicolumba sanctaecrucis",Pigeons and Doves / Columbiformes,"Pigeons, Doves / Columbidae",Pampusana,Australasia,Santa Cruz Is. (se Solomon Is.) and Vanuatu,https://dibird.com/species/santa-cruz-ground-dove/,-
0,santa-cruz-shrikebill,EN - Endangered,"Nendo Shrikebill, Black-throated Shrikebill (Santa Cruz)","Clytorhynchus nigrogularis sanctaecrucis, Clytorhynchus santaecrucis",Perching Birds / Passeriformes,Monarchs / Monarchidae,Clytorhynchus,Pacific ocean,Santa Cruz Is. and Solomon Is.,https://dibird.com/species/santa-cruz-shrikebill/,-
0,santa-cruz-whiteeye,LC - Least concern,"Nendo White-eye, Santa Cruz White eye","Zosterops santaecrucis, Zosterops sanctae-crucis",Perching Birds / Passeriformes,White-eyes / Zosteropidae,Zosterops,Australasia,Santa Cruz Is.,https://dibird.com/species/santa-cruz-whiteeye/,-
0,santa-marta-antbird,NT - Near threatened,Santa Maria Antbird,Drymophila caudata hellmayri,Perching Birds / Passeriformes,Antbirds / Thamnophilidae,Drymophila,South America,Santa Marta Mts. (Colombia),https://dibird.com/species/santa-marta-antbird/,-
